{
  "algorithm": "sha256",
  "created_at_volatile": "2026-01-08T21:48:41.064923Z",
  "episode_id": "change-7e8adef6",
  "execution_id": "change-7e8adef6",
  "files": [
    {
      "path": "auditpack/episode/approvals/approval.json",
      "sha256": "sha256:2319393589c4816b262cdd934e9ed802dc212e6b4250618cc5589b6bd0d4d6ff",
      "size_bytes": 622
    },
    {
      "path": "auditpack/episode/change_request/change_request.json",
      "sha256": "sha256:0a45720fef1dd088f2844db3de7bfa4b4fc8583bf2ed82acea81cc05a955252d",
      "size_bytes": 1996
    },
    {
      "path": "auditpack/episode/contracts/ir.json",
      "sha256": "sha256:4702910cf3e7b2fc2ebdd69526913dba6f4cd13cf352fbd1e56233f5974376a6",
      "size_bytes": 6549
    },
    {
      "path": "auditpack/episode/contracts/openapi.json",
      "sha256": "sha256:914ae35241b4d3a5b23bb93e35a2fc5c7920c1a3ecac88eeb0668a402548dae9",
      "size_bytes": 10067
    },
    {
      "path": "auditpack/episode/contracts/plan.json",
      "sha256": "sha256:00da5b75560e40fb7d13c3fcb81abf9308de22d126cb55619f801a71f0323651",
      "size_bytes": 13523
    },
    {
      "path": "auditpack/episode/contracts/srs.json",
      "sha256": "sha256:4e3b82b7440ce9f9595204b94584fd3882422bdff6141050d18d49007688d3ec",
      "size_bytes": 6268
    },
    {
      "path": "auditpack/episode/manifest.json",
      "sha256": "sha256:eff880682fbd9706b97a2af737163a58ed4aa1d5f331dd0ecbce4daf870330f1",
      "size_bytes": 2287
    },
    {
      "path": "auditpack/episode/runlog.json",
      "sha256": "sha256:4beebb71d9bddf59521b57cb282f5616f412c2c963da6618b2f3cf973686651d",
      "size_bytes": 3397
    }
  ],
  "include_artifacts": true,
  "root_hash_sha256": "sha256:28f0d56dabf999e386be57f434795576b7629ce934ce99c63b4984de948d99ad",
  "schema_version": "auditpack_index.v1",
  "source_episode_root_hash": "sha256:5d51d09e42319463bdb0d2168b6c17adafab089d1a8f0838e58a23dd117d2198",
  "stats": {
    "has_approval": true,
    "has_change_request": true,
    "has_legacy_verify": false,
    "total_files": 8,
    "total_size_bytes": 44709
  }
}